{
  "$schema": "https://json-schema.org/draft/2020-12/schema",
  "type": "object",
  "required": ["id", "edition", "paper", "durationMinutes", "expectedQuestionCount", "questionSourceId", "answerSourceId", "workedSolutionSourceId", "completeness", "contentStage", "onlineQuestionCount", "audit"],
  "properties": {
    "id": { "type": "string", "pattern": "^tmua-.+-p[12]$" },
    "edition": { "type": "string" },
    "paper": { "enum": [1, 2] },
    "durationMinutes": { "const": 75 },
    "expectedQuestionCount": { "const": 20 },
    "questionSourceId": { "type": "string", "minLength": 1 },
    "answerSourceId": { "type": "string", "minLength": 1 },
    "workedSolutionSourceId": { "type": "string", "minLength": 1 },
    "completeness": { "enum": ["complete", "incomplete"] },
    "contentStage": { "enum": ["discovered", "indexed", "extracted", "verified", "published"] },
    "onlineQuestionCount": { "type": "integer", "minimum": 0, "maximum": 20 },
    "audit": { "type": "object", "required": ["generatedAt", "generatedBy", "schemaVersion", "changeReason"], "properties": { "generatedAt": { "type": "string" }, "generatedBy": { "const": "tmua-corpus-cli" }, "schemaVersion": { "const": 1 }, "changeReason": { "type": "string", "minLength": 1 } }, "additionalProperties": false }
  },
  "additionalProperties": false
}
